text,positive,lemm_text
"Офигенный день!
день позитива)
бегал как идиот целый день!
танцы офигенны, хоть я и ракал но мне очень понравилось!",1,офигенный день день позитив бегать как идиот целый день танец офигенный хоть я и ракать но я очень понравиться 
RT @vyrewysaqaj: Почему-то с утра вспомнил свой фидошный пойнтовый номерок и нашел прекрасное   Хрена се. Я уж и историю эту забыл. :D,1,почему то с утро вспомнить свой фидошный пойнтовый номерок и найти прекрасный хрен се я уж и история этот забыть 
"Офигенный день!
день позитива)
бегал как идиот целый день!
танцы офигенны, хоть я и ракал но мне очень понравилось!",1,офигенный день день позитив бегать как идиот целый день танец офигенный хоть я и ракать но я очень понравиться 
"@epnop нет) а ты?
если б я по субботам учился, я бы повесился..",1,нет а ты если б я по суббота учиться я бы повеситься 
"Ученые установили, что если пищу пережевывать, то давятся витамины, а если не пережевывать - люди.))",1,учёный установить что если пища пережёвывать то давиться витамин а если не пережёвывать человек 
"RT @KaprPolichka: @iana_dmitrievna самые молодцы, устала ужас))))",1,самый молодец устать ужас 
"@mehovny ыыы, спасиба! Надеюсь, год рождения твой верно запомнил)",1,ыыы спасиб надеяться год рождение твой верно запомнить 
"@Dafochka хаха, я знаю, как перепишу тебя в телефоне :))) Спасибо))",1,хах я знать как переписать ты в телефон спасибо 
"@itolmach у вас столько крутых деталей в доме! Хочу ""развидеть"") @_iGloria",1,у вы столько крутой деталь в дом хотеть развидеть 
RT @DiniTulip: ЛЕРАААА 15 ПРИЕДЕТ!! УРАААА)))) ДИНИ ЛАВ СЧАСТЛИВА ^.^,1,лераааа приехать ураааа диня лава счастливый 
"в общем,Карина,Лера ,Катя-площадка А!Настя ,Ира-на площадке В и С !и Даша -площадка С!))",1,в общий карина лера катя площадка а настя ир на площадка в и с и даша площадка с 
"@aleks879 мне тоже, а не нравится - И вообще... он не существует :D",1,я тоже а не нравиться и вообще он не существовать 
"@Camilla_Gi от души ребята,ахах,всегда так кстати:))",1,от душа ребята ахи всегда так кстати 
"мм да уж...я думала,что я после урока географии без волос останусь после причесок,которые мне делали Данил,Макс,Некит и Паша:D",1,мм да уж я думать что я после урок география без волос остаться после причёска который я делать данил макс некит и паша 
"Зима-холода))))гэй,Чучо))) @ Циркуни / Tsyrkuny http://t.co/OmeqMBZPk4",1,зима холод гэй чучо циркунь 
"@NicoleElHarris @initialness у меня эти пара - мои одноклассники, которые за-дол-ба-ли читать мои твиты.И плевать,что потом из этого будет:D",1,у я этот пара мой одноклассник который за дол ба ли читать мой твит и плевать что потом из это быть 
"Вот только вчера об этом говорили и на тебе! Но есть плюс, теперь все точно знают, как произносятся бренды:-) http://t.co/Hz9eyGjIWY",1,вот только вчера о это говорить и на ты но есть плюс теперь весь точно знать как произноситься бренд 
"Прям метаюсь: 4 мегабита — халявных, или 10 мгбит за которые надо платить? Жуйк, помоги с решением :D",1,прям метаюсь мегабит халявный или мгбитый за который надо платить жуйк помочь с решение 
"Пришла домой, по пути было весело :D @InessaBelyaeva",1,пришлый домой по путь быть весело 
"@JIRNI_PIROJOK какую серию?)
Амм я голову мыть собираюсь :о",1,какой серия амма я голова мыть собираться о 
"Местный арматурный завод. Мишн комплит. Экселлент. 
Спасибо местной суперкулинарии за то, что дала спокойно собраться с мыслями)",1,местный арматурный завод мишн комплита экселлента спасибо местный суперкулинария за то что дать спокойно собраться с мысль 
Тепло в каждый дом ! Обогреватели )) Как же тяжко без них. #ВлГУ #ПолитехникВлГУ http://t.co/7rMgl2Qdgk,1,тепло в каждый дом обогреватель как же тяжко без они влгу политехниквлга 
"Ух ты, как Гугл разошелся :) http://t.co/9bmBNQlFua",1,ух ты как гугл разойтись 
RT @___nicotine___: @susanballion ведьма маслуша)) а я всего лишь читаю мысли)),1,ведьма маслуша а я всего лишь читать мысль 
"Мне нравится логика наших боевиков - вышибить дверь из двустволки, а потом тихо красться, чтоб никто не слышал...=)",1,я нравиться логика наш боевик вышибить дверь из двустволка а потом тихо красться чтоб никто не слышать 
"@shiranutrixter ОТЛИЧНО, куплю себе грим чтоб нарисовать щетину. :D",1,отлично купить себя грим чтоб нарисовать щетина 
"@MashaBodashko конечно расскажу,  даже фотки скину)",1,конечно рассказать даже фотка скинуть 
"круть. за прогулку получил 50 грн... а когда пришёл домой, увидел, что тут уже без меня пылесосят :)",1,круть за прогулка получить грн а когда прийти домой увидеть что тут уже без я пылесосить 
"Когда я только зарегистрировалась в твиттере то не думала что у меня будет больше чем 10 читателей:D 
Ну хоть в чем то я ошиблась:D",1,когда я только зарегистрироваться в твиттер то не думать что у я быть большой чем читатель ну хоть в чем то я ошибиться 
"RT @MarinaKravets: )) Сегодня на ТНТ в @ComedyClubRu: эээ.. шутливая сценка про девушек, кот. выкладывают в ин-те ВСЕ свои фотки )) http://…",1,сегодня на тнт в эээ шутливый сценка про девушка кот выкладывать в ин тот весь свой фотка 
"хахаха.чайсахартелефонзвонит.хахаха ,как же я тебя люблю)))",1,хахах чайсахартелефонзвонить хахах как же я ты любить 
RT @vika_tar: @Ankirillovna Поздравляю)))ура ))) удачи и любви в новом году))),1,поздравлять ура удача и любовь в новый год 
"В салон евросеть требуются сотрудники. Пишите, приходите)",1,в салон евросеть требоваться сотрудник писать приходить 
RT @tanusja2000: @MilenaAskerova1 это судьба просто:D,1,это судьба просто 
RT @goonveronika: @N_A_D_U_X_A ты просто на дне гимназиста ещё не разу не была:DDDD,1,ты просто на день гимназист ещё не раз не быть 
"Приехали за подарками к н.г., настроение не праздничное у меня, конечно) http://t.co/k641KwWyEU",1,приехать за подарок к наш год настроение не праздничный у я конечно 
"@sdemidov @derloos @Istorkin @k0t_leta @tobecontrol да должно хватать, чо вы тут раздуваете )",1,да должный хватать чо вы тут раздувать 
RT @teo_lemmon: @Helga__Russia @kot_kokc норм всё :D,1,норма весь 
"Сидели на репетиции угорали над ...:D
Не всё таки она наивная,думает мне будет обидно:D",1,сидеть на репетиция угорать над не весь таки она наивный думать я быть обидный 
"До #мсдп доезжают только самые стойкие, такие как @KirillSchitov :D",1,до мсдп доезжать только самый стойкий такой как 
@lerochkam7 все-таки не хочешь идти на свой матан?),1,весь таки не хотеть идти на свой матан 
"RT @Shelkusha: у Никиты мама офигенная,сегодня с Дашей познакомились)",1,у никита мама офигенный сегодня с даша познакомиться 
"Сегодня последние воскресенье уходящего лета 2011! Оторвитесь по полной, друзья ;)",1,сегодня последний воскресение уходить лето оторваться по полный друг 
"@marinakravets @comedyclubru, хорошая)) уже посмотрела",1,хороший уже посмотреть 
"Какой будет эта зима? — надеюсь,что будет офигенной) http://t.co/wwGts0nU1e",1,какой быть этот зима надеяться что быть офигенный 
"@viktorovalex ты сходи узнай цены на Российской почте то :) а то на бумаге там тоже написано одно, а на деле выйдет пипец)",1,ты сходить узнать цена на российский почта то а то на бумага там тоже написать один а на дело выйти пипец 
"С годами я делаю меньше глупостей,но...качественнее...)))",1,с годами я делать маленький глупость но качественный 
"Хах, все на работе сегодня будут пороть на ДР начальника, значит все с утра будут болеть и на работу можно не ехать завтра.))",1,хах весь на работа сегодня быть пороть на др начальник значит весь с утро быть болеть и на работа можно не ехать завтра 
"Эх, лень, переписываемся в контакте, живя в соседних комнатах)))",1,эх лень переписываться в контакт живить в соседний комната 
"@infomoscow24 скажите, пожалуйста , как к вам попасть на съёмки ""живой звук"" ???  Спасибо заранее!))",1,сказать пожалуйста как к вы попасть на съёмка живой звук спасибо заранее 
@balandin73 Тут все красавцы..один недомерок - ушлепок))))),1,тут весь красавец один недомерок ушлепок 
@Dr_Aziz_A Быть может Любовь ? Сердцу не прикажешь! Ахахаха))),1,быть мочь любовь сердце не приказать ахахах 
"Тина красавица же какая, мне она нравится). http://t.co/9uK32zzkYE",1,тина красавица же какой я она нравиться 
@Mork_skay @lenlekk @Barmaleevich @Dnevnik_Yoga @stasko08 @Stas730U @Rita__kz не завидую. мне вот до сих пор солнце в глаз светит ))),1,не завидовать я вот до сей пора солнце в глаз светить 
"RT @Doctor___WHORE: @LittleVantie вот-вот!)
Ладно, я пожалуй пойду рисовать.
Удачи тебе.)",1,вот вот ладный я пожалуй пойти рисовать удача ты 
"Пиздец как хочется дышать свежей, но погоды ждать не вариант сидя на багаже ;)",1,пиздец как хотеться дышать свежеть но погода ждать не вариант сидеть на багаж 
"Вопрос: а   правда читает всех 438 человек, на которых подписан? :)",1,вопрос а правда читать весь человек на который подписать 
"Леха, прислал видео на мыло, смотрите и пишите)))))",1,лёха прислать видео на мыло смотреть и писать 
"Оказывается у меня нет пар со среды, в четверг выезжаю в Тюмень)",1,оказываться у я нет пара с среда в четверг выезжать в тюмень 
"@re_I_d @rodichevrussia о, он меня для количества зафоловил)",1,о он я для количество зафоловить 
"@yakudzablr МТС vs life:) — я бы брал симку и шел по обычным местам обитания с живым тестом. Пользуюсь обоими, от лайфа впечатления лучше.",1,мтс я бы брать симка и идти по обычный место обитание с живой тест пользоваться оба от лайф впечатление хороший 
@di_kalimullina что вы там делайте?:)я тоже хочу :),1,что вы там делать я тоже хотеть 
"RT @ronyzudamo: В интернетах сегодня должно быть меньше народу, ибо синдром первого числа. :)",1,в интернет сегодня должный быть маленький народ ибо синдром первое число 
"кто-то завтра получит чирака, и этот кто-то будет влад)",1,кто то завтра получить чирак и этот кто то быть влад 
@Angie_Enzorry потом ходили страховку забирать )) @svaluev @Shk_Evgeniy @Rudeti @aaaidar,1,потом ходить страховка забирать 
"Временами бывает так плохо, что не знаешь: 03 набрать или 0,5 открыть...))",1,временами бывать так плохо что не знаешь набрать или открыть 
"навалило столько снега!!!
Класс!!
вот теперь есть чувство зимы)))",1,навалить столько снег класс вот теперь есть чувство зима 
какой крутецкий магазин открылся)) прям как в Мск!!!,1,какой крутецкий магазин открыться прям как в мск 
@IvanChert Ну я ж написал) Это могло как всегда длиться бесконечно - пришлось спешно искать предлог идти куда то.,1,ну я ж написать это мочь как всегда длиться бесконечно прийтись спешно искать предлог идти куда то 
"@kucko_joy сенк ю! Рыбок не было, да и они все таки больше мужской символ,зато нашел кое чо  покруче ))",1,сенк ю рыбка не быть да и они весь таки большой мужской символ зато найти кой чо крутой 
RT @devynofumove: Немного обновил   долго думал почему там при выключенных картинках лого nigma.ru было нулевого размера :) оказалось это д,1,немного обновить долго думать почему там при выключить картинка лого быть нулевой размер оказаться это далее 
"КИНОМАШКА: МИСТИКА И ФАНТАСТИКА!!! http://t.co/dct4zURRCS Это гавно, но щас посмотрим :-) #кино",1,киномашка мистика и фантастика это гавный но щас посмотреть кино 
"Как думаешь, какой ты цвет? Каким бы хотел быть? — ммм
красный, да :-) http://t.co/saTWOXcCh3",1,как думать какой ты цвета какой бы хотеть быть ммм красный да 
"""И если он счстлив- я вдвойне"" и кого вы обманываете?)&lt;img src=""http://t.co/jvoQcdqr4e""&amp;#8230;",1,и если он счстлить я вдвойне и кто вы обманывать 
"Я настолько энергична, что даже Кролик Энерджайзер мне не конкурент!!!!)",1,я настолько энергичный что даже кролик энерджайзер я не конкурент 
"RT @neresident: Вячеслав ""Мудило ёбаное"" Макаров пошел по стопам Андрея ""Сраного"" Турчака. Люблю такое)",1,вячеслав мудить ёбаной макаров пойти по стопа андрей сраный турчак любить такой 
"RT @KnjazevAn: @Poshlayaaa Ты красивая на этом ФОТО! Счастья тебе, такого, какого ты хочешь...! :-)",1,ты красивый на это фото счастие ты такой какой ты хотеть 
"Эмоции переполняют через край,как сказала Даша ""улыбаторы"" болят )активная ходьба и бег и ""исключительно""здоровое питания.я тебя люблю ЭКО",1,эмоция переполнять через край как сказать даша улыбатор болеть активный ходьба и бег и исключительно здоровый питание я ты любить эко 
"если бы вызнали для чего он ее использовал, не писали бы так:)",1,если бы вызнать для что он она использовать не писать бы так 
RT @LudmilaSadovaja: В семье не без урода....) http://t.co/jG1rEEefwU,1,в семья не без урод 
RT @nastya_avenberg: много много снега...круто круто),1,много много снег круто круто 
Masterplan – Lonely Winds of War. Тег fucking awesome на ласт.фм 100% отражает суть :),1,тег на ласт фм отражать быть 
"@Jef1169 хуясе)
я из Украины
долбаные часовые пояса)",1,хуяс я из украина долбаный часовой пояс 
"@AndrewVostrikov мое детство, к сожалению, прошло не в интернете, а с игрушками, прибитыми к полу и книжками)",1,мой детство к сожаление прошлый не в интернет а с игрушка прибить к пол и книжка 
@VadikBogdanov как-то пофиг)) Лично мне ничем эти даты не запомнились. Разве что тем что они были.,1,как то пофига лично я ничто этот дата не запомниться разве что тем что они быть 
RT @pavlov718: @m_karisha145  Смотри :D http://t.co/Ea37vgf4Aa,1,смотреть 
@Miss_Bublik там вроде и Челябинские вставки) а снимают в Подольске),1,там вроде и челябинский вставка а снимать в подольск 
-Да бля у тебя чё ноги из жопы что-ли растут? -О_о..)),1,да бля у ты чё нога из жопа что ли расти о о 
RT @ship__cam: А здесь Гарри вообще подмышки брызгал. Похуй вообще на камеры х) http://t.co/Vj5ivif1Hh,1,а здесь гарри вообще подмышка брызгало похуй вообще на камера х 
RT @abnepo: Пришел к Френку. Какой же он красивый!..))),1,прийти к фрёнок какой же он красивый 
https://t.co/wsob1KjYKz О БОГИ. Моей детской психике окончательная пизда пришла),1,о бог мой детский психика окончательный пизда пришлый 
"Охереть, Новак, Гарри, Луи, Зейн и Лиам читает Криштиану :D",1,охереть новак гарри луи зейн и лиам читать криштиан 
RT @abnepo: Сейчас была забавная картина - Надя и официантка рядом с ней с одинаковыми взглядами в окно смотрели... Зависли Х),1,сейчас быть забавный картина надя и официантка ряд с она с одинаковый взгляд в окно смотреть зависнуть х 
"@OldVegetable Привет,Конёчек!
кушай,не обращай на него внимание))",1,привет конёчек кушать не обращать на он внимание 
RT @boryanchik_chrp: Это про меня сегодня) http://t.co/tKYEnqeNCK,1,это про я сегодня 
"@Kate_Lotts рада :3
надеюсь, уже в шк все впоряде))
У меня шикарно!))",1,рада надеяться уже в шк весь впоряд у я шикарно 
"RT @mila_squirrel: @little_stuff_ хорошеньких снов, пупсик ты мой!)))))))))))))))*))))))***",1,хорошенький сон пупсик ты мой 
"я ушел на хор)не останавливайтесь только,прошу!)
#mtvstars 30 Seconds To Mars",1,я уйти на хор не останавливаться только просить 
@sdemidov @simply_mollie в общем ясно с вами все - нынче все на грамоту.ру смотрят ),1,в общий ясно с вы весь нынче весь на грамота ру смотреть 
"RT @dasowavasuw: подружка записалась на курсы,теперь будет на мне тренироваться )) перевернулся на моей улице :)",1,подружка записаться на курс теперь быть на я тренироваться перевернуться на мой улица 
Q: здарова. зацени что у меня на странице написано. реально работает по моему) жесть)  A: http://t.co/HB2458P9da,1,здаров заценить что у я на страница написать реально работать по мой жесть 
"Посмотрел ""Солт"". Ну и хрень! :) Но Джоли нравится. :)",1,посмотреть солт ну и хрень но джоля нравиться 
