text,positive,lemm_text
"Теперь и @ruslanlesbi в моей ленте :D я не знаю, кто ты, но ты подписан на моих бро, з
А бро моих бро мой бро",1,теперь и в мой лента я не знать кто ты но ты подписать на мой бро з а бро мой бро мой бро 
"Даша не школьник, а гимназист. Не путайте разницу:D — Ахах
точно http://t.co/1Rq7NsVkAw",1,даша не школьник а гимназист не путать разница ахи точно 
@SViktoruya Ахахахахха....За мандаринку:DИбо нефиг воровать.....,1,ахахахахха за мандаринка ибо нефига воровать 
"@inyamedvedeva ахаххахах , ты только глянь , какие попки :) какие трусы ,о чем ты",1,ахаххахи ты только глянуть какой попка какой трус о чем ты 
"напиться и снова пойти на занятия? мы с настей можем всё:) жаль, что пласт напомнил о себее фу",1,напиться и снова пойти на занятие мы с настя мочь весь жаль что пласт напомнить о себей фу 
"Спасибо Камиллке за то, что пришла на историю) Не провал!))",1,спасибо камиллка за то что пришлый на история не провал 
@danny_norman @pashkenziy как раз по первому смотрела:-),1,как раз по первое смотреть 
RT @hyzejogusy: обычно по новостям у нас перевод идёт с русского на украинский.. а тут нашёл какие-то новости где всё наоборот :D,1,обычно по новость у мы перевод идти с русский на украинский а тут найти какой то новость где весь наоборот 
Ура!!! на Новый Год отдыхаем 5 дней!!! с 1-го по 5-ое!!! :-),1,ура на новый год отдыхать день с го по ое 
"Вы говорите, что я вам дорог и бла бла, но никто из вас не позвонил спросить как дела или на улицу позвать 
Спасибо :)",1,вы говорить что я вы дорога и бла бла но никто из вы не позвонить спросить как дело или на улица позвать спасибо 
"в моем сне Луи признался, что они с Гарри - пара, так что.. идите нахуй, я не перестану в них верить НИ-КОГ-ДА! :D",1,в мыть сон луи признаться что они с гарри пара так что идти нахуй я не перестать в они верить ни ког да 
"RT @gusak_av: Посмотрите, какие прекрасные вопросы поднимаются на сайте Тихорецкого совета депутатов! :)
 http://t.co/QfnS4z1Tqm",1,посмотреть какой прекрасный вопрос подниматься на сайт тихорецкий совет депутат 
"Я теперь знаю, где живёт Солнце! В моём сердце... )",1,я теперь знать где жить солнце в мой сердце 
"@kuzemman не, на самом деле, никакого адового веселья не было)это просто мне было весело, еще в Элвисе все началось) так что не пропустил",1,не на самый дело никакой адовый веселие не быть это просто я быть весело ещё в элвис весь начаться так что не пропустить 
"Я так счастлива!Зачет по лабораторной по физике! ^_^
#счастье",1,я так счастливый зачёт по лабораторный по физика счастие 
"В информации сейчас диалоги круче и веселее, чем в ""Дне радио""! Наша редакция прекрасна!) Можно записывать и отдать для книги или сценария))",1,в информация сейчас диалог круча и весёлый чем в день радио наш редакция прекрасный можно записывать и отдать для книга или сценарий 
С первым снегом свежую зимнюю резину :) http://t.co/MxEvf8xNhS,1,с один снег свежевать зимний резина 
"@swinopass и ты чего,ведешься??)смотри,без штанов оставят",1,и ты что вестись смотреть без штаны оставить 
"ну, что ж, буду просить в воскресенье маму взять с собой)",1,ну что ж быть просить в воскресение мама взять с себя 
Какой будет эта зима? — лучшей:) http://t.co/yPYOzotW4s,1,какой быть этот зима хороший 
"Недавно назвала Университет ""моя бывшая шарага"". Те, кто был рядом поперхнулись. А фигли, всё меняется ;)",1,недавно назвать университет мой бывший шарага тот кто быть ряд поперхнуться а фичь весь меняться 
Какие красивые цветы:) С днем рождения мамочка!:* /party/ http://t.co/s9pXdW7dF5,1,какой красивый цвета с днём рождение мамочка 
Нароооод)))) смотрим) вспоминаем) ТАНЦУЮТ ВСЕ))) http://t.co/d47Bl1Zvml,1,нароооод смотреть вспоминать танцевать весь 
"Отныне я поклоняюсь Каплану и осную религию СТРЫКАЛИЗМ! И я пророк этого дела ^_^

Надо бы vk группу создать!",1,отныне я поклоняться каплан и основать религия стрыкализм и я пророк это дело надо бы группа создать 
"и почему практически все темы моих писем выглядят как ""хаха"" , ""тутуту"" , ""пыщь-пыщь"" или подобным образом? %)",1,и почему практически весь тема мой письмо выглядеть как хах тутут пыщь пыщь или подобный образ 
@anna_miley_anna как мило^^ спасибо:)  но уже 2-х:D даже я не заметила Оо я думала у меня щас 1890 лол... КАК ТАК ТО,1,как мило спасибо но уже х даже я не заметить оо я думать у я щас лола как так то 
"@vitatomas1 за то,что квитанции не отдала,бегала в школу относила) и за фелармонию)) он асказала что бы завтра  пришло на неё 10 человек)",1,за то что квитанция не отдать бегать в школа относить и за фелармония он асказать что бы завтра пришлый на она человек 
"@robinwitaker нет.
Как же твои девочки,без такого старосты?)))",1,нет как же твой девочка без такой староста 
"@loverulesdude, мне тут Гошан недавно приору золотую купить предлагал;)",1,я тут гошана недавно приор золотой купить предлагать 
"Фильм понравился) пример просто отличной экранизации, даже упитанность Китнисс уже привычна #ГИ",1,фильм понравиться пример просто отличный экранизация даже упитанность китнисса уже привычный ги 
"Дааааааа, вот это я понимаю ВЫЕЗД!) http://t.co/7caCGARAew",1,дааааааа вот это я понимать выезд 
"макдак, дрифт с Вовкой на прокаченной приоре, потом каток и гонки по ночному городу)",1,макдак дрифт с вовка на прокатить приор потом каток и гонка по ночное город 
Записываю Ленина)Круто стелит http://t.co/9RzskYqgmU,1,записывать ленин круто стелить 
"Наши друзья, компания Moqod, сделали iOS приложения для нашего сообщества! Качаем, смотрим, пользуемся :) http://t.co/aSCQmTJ9Gf",1,наш друг компания сделать приложение для наш сообщество качать смотреть пользоваться 
"Аааа )и те выходные -праздничные ))))
Когда я возьмусь за учебу ?!!!)",1,аааа и тот выходной праздничный когда я взяться за учёба 
"@RitaKameneva @Katerohcek @nirvankalol ахахаха а я сказала,но она сказала типо я на фитнес,мне срать на твою учебу,ясно мам)",1,ахахах а я сказать но она сказать типо я на фитнес я срать на твой учёба ясно мама 
"RT @Gau_Bee: Ну е-мое. Зачем говорить мне, нравится вам или нет моя прическа? Мне ж...как бы это сказать...ПЛЕВАТЬ.)",1,ну е мой зачем говорить я нравиться вы или нет мой причёска я ж как бы это сказать плевать 
"RT @l_enskaya: Ржу ПЗДЦ!!!!!))))ахаххаха)))))Бывает же такое)) 
""Сейчас такую аварию заснял.....Я тебе перезвоню зая""
http://t.co/rNfoUI13ZC",1,ржа пздца ахаххах бывать же такой сейчас такой авария заснять я ты перезвонить зая 
"RT @_K_M_V_: Вот бы сделать дома уборку и нажать ""Сохранить""!))) http://t.co/D6LLHe37Q8",1,вот бы сделать дом уборка и нажать сохранить 
@All_For_Melody Ух ты! И дата есть) Точно считаю подарком! :D,1,ух ты и дата есть точно считать подарок 
"@IdahoForever мы единственные, кто рады этому настолько) да)",1,мы единственный кто рад это настолько да 
"@iasineigor даа :) а вчера была Арбенина. Неземное зрелище! И куча #ЛГБТ, естественно)",1,даа а вчера быть арбенин неземной зрелище и куча лгбт естественно 
Сергею лазареву в новом клипе сердце и лицо разбила красотка-боксерша :)  http://t.co/sunkMKm0SK  #премьера #СергейЛазарев #новый_клип,1,сергей лазарев в новый клип сердце и лицо разбить красотка боксёрш премьера сергейлазарев новый клип 
"Я уже и забыла как это писать в твиттер! Зашла сегодня, и знаете, как домой пришла. Я вернулась;)",1,я уже и забыть как это писать в твиттереть зайти сегодня и знаете как домой пришлый я вернуться 
Настроил кросспост из жуйки в тви. Посмотрим как оно всё выглядит :),1,настроить кросспост из жуйка в тви посмотреть как оно весь выглядеть 
"Еээ нэг ч хvн бдаггvйэ, заза над шиг ингэж дасгал хийдэг хvн ч гэж юу бхав :)))))",1,еээ нэг число х наш бдагга йэ заза над шиг ингэж дасгала хийдэг х наш число гэж юу бхать 
"@bortkovika порадуешься, когда саму историю расскажу)",1,порадоваться когда сам история рассказать 
Нашел в старом проекте 8454 строк пхп кода. Я тогда совсем не умел программировать :),1,найти в старый проект строка пхп код я тогда совсем не уметь программировать 
"Какой-то мужик на улице сказал. что я красивая :) Такая мелочь, но у меня уже полдня хорошее настроение =)",1,какой то мужик на улица сказать что я красивый такой мелочь но у я уже полдень хороший настроение 
"@anya_hi ну он зайдет, увидит твой лайк) и воспрянет духом",1,ну он зайти увидеть твой лайк и воспрянуть дух 
"Что-то в этом есть, не находите? ;) http://t.co/AWB2HkOJmF",1,что то в это есть не находить 
Я за день читаю столько ленты.... Война и Мир явно в прошлом),1,я за день читать столько лента война и мир явно в прошлое 
@angrydeadrocker @satanicundead @Eye_pain_ @yatsan_ho @loveeeTDG @dobryak3 @ms_zelenyy @tmdnn @libya_nadia спасибо),1,спасибо 
"Меня всегда умиляет животное, могущее положить под щеку заднюю и переднюю лапы одновременно. :)",1,я всегда умилять животный мочь положить под щека задний и передний лапа одновременно 
"@Xiongmao_Tao @miracle_musical Это да, но всем плевать что он делает, если в колледж не красит, но все нормально. В этом плане ему повезло))",1,это да но весь плевать что он делать если в колледж не красить но весь нормальный в это план он повезти 
RT @smirnitskaya519: Многократный чемпион по самбо #стукнул тростью об асфальт в Петербурге. #улыбнуло ;) #SuperRetweet,1,многократный чемпион по самбо стукнуть трость о асфальт в петербург улыбнуть 
"RT @hg_cf_imagine: О боженьки, это лучший день в моей жизни) не может быть, меня читает Китнисс.",1,о боженька это хороший день в мой жизнь не мочь быть я читать китнисса 
RT @marina_al_42665: Как не крути..а жопа всегда сзади),1,как не крутить а жопа всегда сзади 
"@semvyso, Хорошо, что есть праздники) Хоть на какое то время можно забыть про работу.",1,хорошо что есть праздник хоть на какой то время можно забыть про работа 
бумажный скотч спасет мир!мне не чем было зафиксировать бинт вокруг пальца и тут пришел ОН - бумажный скотч!)),1,бумажный скотч спасти мир я не чем быть зафиксировать бинт вокруг палец и тут прийти он бумажный скотч 
@balandin73 тоже так думаю! :) Нельзя же всё время быть сурьёзной :) @topoprf @NovLena,1,тоже так думать нельзя же весь время быть сурьёзной 
"@poli_afonina Надо было скользить на пузе, ты ж тюлень или где?:D Ничего, все пройдет с:",1,надо быть скользить на пузо ты ж тюлень или где ничто весь пройти с 
Мои хорошие:) соскучилась уже*)) http://t.co/QG2VMnFsFA,1,мой хороший соскучиться уже 
"Какой будет эта зима? — Чудесной)
Я думаю что в эту зиму произойдет много хорошего :33 http://t.co/3iW6QllHoy",1,какой быть этот зима чудесный я думать что в этот зима произойти много хороший 
"Вспоминаю это фото каждый раз, когда мама говорит, что я взрослая)) http://t.co/TlZB60tuDF",1,вспоминать это фото каждый раз когда мама говорить что я взрослый 
"С самого утра хихоньки-хахоньки;)
Обожаю пятницу, она как всегда веселая)",1,с самый утро хихоньки хахоньки обожать пятница она как всегда весёлый 
"у меня есть именная сига, а у вас нет :D http://t.co/Ow9LovXaN3",1,у я есть именной сиг а у вы нет 
"RT @kaktusMorcesa: @morenchik8 еще побываешь) думаю, что мест красивых полно, а вот люди....",1,ещё побывать думать что место красивый полно а вот человек 
"@LeeMalfoy вам еще нужна бета?:)У
уж очень люблю это дело.",1,вы ещё нужный бета у уж очень любить это дело 
@MashMashik а вообще я сперва тебе раскадровку должна),1,а вообще я сперва ты раскадровка должный 
"за полгода сгорела мать, БП, монитор ... может у меня правда комп не по фэн-шую расположен :D",1,за полгода сгореть мать бп монитор мочь у я правда комп не по фэн шуя расположить 
"Знаете,что такое справедливость??
Это когда приходишь на две пары,а у тебя потом нет последних двух))",1,знаете что такой справедливость это когда приходить на два пара а у ты потом нет последний два 
зате мій миколайко приїде вже завтра вночі)чекаю чекаю чекаю,1,зата метр й миколайко при де вже завтра вночий чекать чекать чекать 
"собрав все мысли в кучу стало ясно кто ты )) 
мнение поменялось ;и слава Богу )",1,собрать весь мысль в куча стать ясно кто ты мнение поменяться и слава бог 
@dimka_sai вообще у меня мало звезд которых я раскручиваю) на двух пальцах можно пересчитать,1,вообще у я мало звезда который я раскручивать на два палец можно пересчитать 
@GlukoZa_Ionova меня можно задобрить творожной запеканкой политой сгущеным молоком :-),1,я можно задобрить творожный запеканка полить сгущёный молоко 
"RT @yqymihut: Щас все-таки сдохну :) Но надо победить простуду, привезенную из России :)",1,щас весь таки сдохнуть но надо победить простуда привезти из россия 
"ураа, нашел цепочку! все отлично)
#ухьюстонавсеотлично.",1,ураа найти цепочка весь отлично ухьюстонавсеотличный 
"Хотя мы пока и не знаю где будем отмечать Нг,но...но...как же без платья? :D",1,хотя мы пока и не знать где быть отмечать нг но но как же без платье 
Влюбленная парочка ходит в одинаковых шапках)так мило,1,влюбить парочка ходить в одинаковый шапка так мило 
"Тем. контроль по менеджменту,как я блять его люблю)",1,тем контроль по менеджмент как я блять он любить 
"мне нравится чувствовать, как он смотрит на меня, когда я смотрю куда-то в сторону.)",1,я нравиться чувствовать как он смотреть на я когда я смотреть куда то в сторона 
@GroupIB отпускает каждого третьего киберпреступника :) https://t.co/dASTAoLYyF,1,отпускать каждый третье киберпреступник 
"RT @SevaTarasov: Вы видели, у нашего клипа ""Пока Мы Молоды"" уже почти 1 500 000 просмотров)))!! http://t.co/wOQsnCFfUF #ГЕРОИ #ПокаМыМолоды",1,вы видеть у наш клип пока мы молодой уже почти просмотр герой покамымолод 
RT @picylilywov: еще одна флешка на шею %) Теперь у меня с собой будет 3 флешки.,1,ещё один флешек на шея теперь у я с себя быть флешек 
"P.S.   Послушать не дам. ЭТО даже я до конца дослушать не могу. Так что, я лучше спою как-нить вживую :)",1,послушать не дать это даже я до конец дослушать не мочь так что я хороший спеть как нить вживую 
RT @PuzyrevaV: #СоколовскийЯХочуТебя познакомить с Найлом :) http://t.co/Tp6jTiO9ON,1,соколовскийяхочутести познакомить с найл 
"В 16.00 всем офисом займемся его украшением в мишуру и дождик,и елку поставим) а еще нам в это время будут наконец модернизировать компы:)",1,в весь офис заняться он украшение в мишура и дождик и ёлка поставить а ещё мы в это время быть наконец модернизировать комп 
"RT @Hearthstone_ru: Ключики раздали, но это еще не все! Часа через полтора начнем новую игру, готовьтесь :) #ВсемHearthstone o/",1,ключик раздать но это ещё не весь час через полтора начать новый игра готовиться весь 
Ксю. Ди. Нана. Бублик-26.12  идем на Ледовое шоу:) хахахахахах,1,ксю ди нана бублик идти на ледовый шоу хахахахах 
"Пришли заключать договор по домафону,а я поговорила с ними и ушла дальше смотреть телек:DВот так вот",1,прислать заключать договор по домафон а я поговорить с они и уйти далёкий смотреть телек вот так вот 
"@adelinkaaa да ладно, мы крассвчики, а вы молодцы :-D",1,да ладный мы крассвчик а вы молодец 
"у всех есть твиттер,и у Лизы теперь будет твиттер:D правда пока не понятно зачем:D",1,у весь есть твиттереть и у лиза теперь быть твиттереть правда пока не понятно зачем 
ооо... началась война цен на e-ink устройства :) Радует,1,ооо начаться война цена на устройство радовать 
@Dc_Dro @your_tamagotchi покорми уже своего кота мансаной!! А то линять скоро начнет!!;),1,покормить уже свой кот мансана а то линять скоро начать 
