text,positive,lemm_text
"@first_timee хоть я и школота, но поверь, у нас то же самое :D общество профилирующий предмет типа)",1,хоть я и школотый но поверь у мы то же самый общество профилировать предмет тип 
"Да, все-таки он немного похож на него. Но мой мальчик все равно лучше:D",1,да весь таки он немного похожий на он но мой мальчик весь равно хороший 
RT @KatiaCheh: Ну ты идиотка) я испугалась за тебя!!!,1,ну ты идиотка я испугаться за ты 
"RT @digger2912: ""Кто то в углу сидит и погибает от голода, а мы ещё 2 порции взяли, хотя уже и так жрать не хотим"" :DD http://t.co/GqG6iuE2…",1,кто то в угол сидеть и погибать от голод а мы ещё порция взять хотя уже и так жрать не хотеть 
"@irina_dyshkant Вот что значит страшилка :D
Но блин,посмотрев все части,у тебя создастся ощущение,что авторы курили что-то :D",1,вот что значит страшилка но блин посмотреть весь часть у ты создаться ощущение что автор курить что то 
ну любишь или нет? — Я не знаю кто ты бля:D http://t.co/brf9eNg1U6,1,ну любить или нет я не знать кто ты бля 
"RT @SpoonLamer: Ох,900 :D ну это конечно же @twinkleAYO . Чтобы у нее было много друзей, ведь она такая мимими &lt;3",1,ох ну это конечно же чтобы у нея быть много друг ведь она такой мимими 
RT @veregijytaqo: У тебя есть ухажёр? Нет - мои уши не кто не жрёт :D,1,у ты есть ухажёр нет мой ухо не кто не жрать 
Поприветствуем моего нового читателя @Alexey1789 ;),1,поприветствовать мой новое читатель 
Теперь у меня есть частичка Сиднея :) #Sydney #SydneyOperaHouse http://t.co/agnto3CZEi,1,теперь у я есть частичка сидней 
"Люблю маму и папу!!!!а в остальное я так...-влюбляюсь, привязываюсь))) ",1,любить мама и папа а в остальной я так влюбляться привязываться 
"RT @dicyziqecida: Как-то я забыла, что вчера приехал из деревни наш котэня и испугалась, когда он утром пришел ко мне общаться. :) Доброе у",1,как то я забыть что вчера приехать из деревня наш котэнить и испугаться когда он утром прийти к я общаться добрый у 
"@MrsRourke_s_tit @_vivante @dyu_bryun так было задумано, да :)",1,так быть задумать да 
"@Kruglova_Julia_  дааааа))
Ты... Ты... Ты и только ты...)*",1,дааааа ты ты ты и только ты 
"@Alex_Shvarz :)) О, нет. Вы ведь всё равно обзоры урезаете? Просто одна версия сильно порезанная, а другая полная, только без мусора.",1,о нет вы ведь весь равно обзор урезать просто один версия сильно порезать а другой полный только без мусор 
"@Jyliaalex смотри там случайно в аспирантуру не попади, наука никого до добра не доводила)",1,смотреть там случайно в аспирантура не попасть наука никто до добро не доводить 
"RT @Abdullin_A_R: @LikhodedovaMary эхх, а в УГАТУ о контрольных предупреждают уже на контрольной)",1,эхх а в угата о контрольный предупреждать уже на контрольный 
"@marinaysol а, а то подумала, что у тебя там пробежечка.)",1,а а то подумать что у ты там пробежечка 
@xLesherx @4EU3 зря вы с этой хуйней шутите)) я много историй наблюдал в режиме рил времени по работе с русскими которые разбивались на них,1,зря вы с этот хуйный шутить я много история наблюдать в режим рил время по работа с русский который разбиваться на они 
@Moscow_advokat Очень главное спасибо for   МЕДВЕД™ — он работал клоуном-аниматором!   :-))),1,очень главный спасибо медведа он работать клоун аниматор 
"У нас есть прекрасная история, как сдохнуть за неделю!!)",1,у мы есть прекрасный история как сдохнуть за неделя 
"@Benjamin1610 сегодня столько поводов выпить, что я уже не могу усидеть на месте)",1,сегодня столько повод выпить что я уже не мочь усидеть на место 
@StalinGulag унылый?...наверное...вдруг его перед этим чпокнули?)))),1,унылый наверное вдруг он перед это чпокнуль 
RT @lumenso: @GruzdevVladimir @Sergey_Degtyrev 1) При поддержке администрации МО Белевский район сборная Белевского района по http://t.co/r…,1,при поддержка администрация мо белевский район сборная белевский район по 
Поприветствуем моего нового читателя @afyfglprwl ;),1,поприветствовать мой новое читатель 
"Как же хооорошо валяться, но мой бедный, обколотый попец хочет на прогулку) http://t.co/XugobJeb9c",1,как же хооорошо валяться но мой бедный обколоть попец хотеть на прогулка 
"Хоть у кого то заебись всё) Настюх, рада за тебя пиздец) прям искренне рада)) есть все же справедливость на свете)",1,хоть у кто то заестись весь настюха рада за ты пиздец прям искренне рада есть весь же справедливость на свет 
"да почему мне похуй то)
Новерное потому что еще не ночь темная) )",1,да почему я похуй то новерный потому что ещё не ночь тёмный 
"блин,хочется писать и писать))всякую хуйню пишу,но все равно хочется)",1,блин хотеться писать и писать всякий хуйня писать но весь равно хотеться 
@JuliaLacoste_ @Kate_Craik а мне хотя бы расскажите что по чем),1,а я хотя бы рассказать что по чем 
RT @Lubalubochka2: @edvard146 для тебя;) http://t.co/EPzvFGfLfA,1,для ты 
"@1m_one я по первому не смотрю,поэтому качаю в инете)найди группу в вк Оттепель,там думаю все серии есть)",1,я по первое не смотреть поэтому качать в инуть найти группа в вк оттепель там думать весь серия есть 
Предвкушение  потрясающего уикенда  - Праздник света! Гулять ночи напролет и любоваться огнями :*,1,предвкушение потрясать уикенд праздник свет гулять ночь напролёт и любоваться огонь 
"я рааааааад,ведь сегодня впереди вся ночь,сериалы,фильмы,книга и кофе:) идеальная ночка:)",1,я рааааааад ведь сегодня впереди весь ночь сериал фильм книга и кофе идеальный ночка 
Списком надо! Всем гамузом. :D http://t.co/IL0Y1evQY7,1,список надо весь гамуз 
RT @StarScrim3: #RT Электрогенератор http://t.co/qjlwirfD3A изсостоек и не победим!)),1,электрогенератор изсостойка и не победить 
@mari_filimonova у меня нет фоток ))))) позже тогда кину )))),1,у я нет фотка поздний тогда кинуть 
Второй день подряд мне снятся сны с Ромой. Я сошла с ума) #RomaAcorn,1,два день подряд я сниться сон с рома я сойти с ум 
"RT @amytareva: -слушай, Коть, можно я этим боком встану, так лучше получается? :)
-а у меня наоборот этот! 
@PankratovaKotya лучший человек…",1,слушай коть можно я это боком встать так хороший получаться а у я наоборот этот хороший человек 
RT @qotozobygl: почти в каждых Пиратах-РТ неимоверно радует своими политическими позициями в отсутствии понимания и фактов. :-),1,почти в каждый пират рт неимоверно радовать свой политический позиция в отсутствие понимание и факт 
"-Оля, ты очень добрая на самом деле. 
-А ты сучка злая. Бу на тебя
-Да я та еще тварь
-Заметь, ты сама это сказала
#диалогивофисе

Люблю их)",1,оля ты очень добрый на самый дело а ты сучка злой бу на ты да я тот ещё тварь заметить ты сам это сказать диалогивофис любить они 
"Не иду завтра в школу,первый раз мама так настойчиво не отпускала меня,спасиибки)",1,не идти завтра в школа один раз мама так настойчиво не отпускать я спасиибка 
Как же мне нравятся мужчины в строгих костюмах)) млею!,1,как же я нравиться мужчина в строгий костюм млеть 
"@LilSwallow так это пушистая скотина тоже дрыхнет круглые сутки. просыпается только, чтоб поорать возле миски)",1,так это пушистый скотина тоже дрыхнуть круглый сутки просыпаться только чтоб поорать возле миска 
"@kgshel ахаха
да нормээ)) с моим врачем мне ничего не страшно))",1,ахах да нормээ с мой вракать я ничто не страшно 
"Встречайте, мои супер одногруппницы, будущие историки искусства и моды:) #большиеоригиналы #попятницамносимчерное http://t.co/zGe3pX3F8P",1,встречать мой супер одногруппница будущий историк искусство и мода большиеоригинал попятницамносимчерный 
"все,я вас покидаю,результаты гляну вечером)#биатлон",1,весь я вы покидать результат глянуть вечером биатлон 
"RT @Dasha_crazy_69: @DashkaTeddy дыы))) но кто сказал, что я ВСЕ поняла ааххах?) http://t.co/4dCaFCMXDl",1,дыы но кто сказать что я весь понять аахха 
Почти приехали в родное селенье!) @ москва-рига http://t.co/1MN85mNxwb,1,почти приехать в родной селение москва рига 
На*уй ваши Канары и Мальдивы ! Тут новая тема проскочила ! )) http://t.co/J8PhBhhIgD,1,на уй ваш канары и мальдивы тут новый тема проскочить 
"RT @frankieeway: а стояк теперь снова стояк :-)
вселенная вернула все на свои места",1,а стояк теперь снова стояк вселенная вернуть весь на свой место 
-ПриФетиГг СолНыСко=*КаГ ТфаИ ДиЛа??МнУ сИчаС фФ БоЛьНисЬкУ ИдеТь=) -к логопеду? ,1,прифетигга солныско каг тфай дил мять сичас фф больниська идеть к логопед 
"@3Gun_D да нашла фоточку в иг и нагло спиздила) Ничего, с фотографиями меня уже статусы в вконтакте бывают.",1,да найти фоточка в иго и нагло спиздил ничто с фотография я уже статус в вконтакте бывать 
"А у нас в Нижнем слякотная погода - брр! Но у нас ОФИГЕННЫЙ ПРИВОЗ! ))) Заходим, заходим! http://t.co/9JmNtTAcfE",1,а у мы в нижний слякотный погода брр но у мы офигенный привоз заходить заходить 
"Короче ,видимо ни в какой архитектурный я не иду :)
Там ,капец ,конечно )",1,короче видимо ни в какой архитектурный я не идти там капец конечно 
"@linajj_5 ну в 18 сделаешь тогда)))
я дарья) а ты?)",1,ну в сделать тогда я дарья а ты 
"@Prozene плак-плак,надеюсь на драфте тогда их вытяну :)",1,плак плак надеяться на драфт тогда они вытянуть 
@Chenzana а моя кроме поорать еще просится на балкон хвост поморозить) минуту посидит и назад просится.,1,а мой кроме поорать ещё проситься на балкон хвост поморозить минута посидеть и назад проситься 
Каждому так болеть) когда к тебе друзья в гости ходят,1,каждый так болеть когда к ты друг в гость ходить 
"-мам, мне так хреново!
-выпей таблетку и на работу! на следующей недели пойдем в сауну!
мама умеет поддержать и добавить стимула)",1,мама я так хреновый выпить таблетка и на работа на следующий неделя пойти в сауна мама уметь поддержать и добавить стимул 
"3 тысячи,это не так дорого для пальто лол :D  т.е. пальто криса стоит меньше 200 тыс. рублей",1,тысяча это не так дорого для пальто лола том е пальто крис стоить маленький тысяча рубль 
"RT @jalikuhepan: это так мило, когда парни ставят на аву свои детские фотографии...) http://t.co/qvQjUz842z",1,это так мило когда парень ставить на ава свой детский фотография 
"@iluhaivakin опа, дома никого?
помнишь, что ты мне должен?:D",1,опа дом никто помнить что ты я должный 
"@Juliacka наверное) ну все-равно приятно:D:D:D ахах, я под столой вчера лежала",1,наверное ну весь равно приятно ахи я под стола вчера лежалый 
"@proBokator ... и работал. А не как этот:то потухнет, то погаснет ;)",1,и работать а не как этот то потухнуть то погаснуть 
"@Ksushakos38 лучше бы и то,и другое.)
кстати,после сегодняшнего я кроху ненавижу еще больше.",1,хороший бы и то и другой кстати после сегодняшний я кроха ненавидеть ещё большой 
"@fidelevna ох, прям за год соскучилась. чего забросила прекрасных мужчин, не понимаю?)",1,ох прям за год соскучиться что забросить прекрасный мужчина не понимать 
"RT @tugejivybix: вышел прокатится, через 15 минут зашёл назад весь мокрый :) дождь полил.",1,выйти прокатиться через минута зайти назад весь мокрый дождь полить 
@SofiBelyak а что за татуировка у тебя? фото в студию)),1,а что за татуировка у ты фото в студия 
"@DianaKruchkova ого, надо будет так попробовать с следующий раз :D",1,ого надо быть так попробовать с следующий раз 
"@Alen_gate ахахаха, я тоже сегодня полдня играла в Обломова :D
Примерно до полчетвертого",1,ахахах я тоже сегодня полдень играть в обломов примерно до полчетвертого 
"RT @havabeqoduxi: Ого, на кинопоиске сделали ""саундтреки"" :D а я и не знала. Очень удобнено.",1,ого на кинопоиск сделать саундтрек а я и не знать очень удобнить 
весь мой тви теперь будет наполнен долгожданным снегом)из года в год он меня бросает) http://t.co/PmExOxro9h,1,весь мой тви теперь быть наполнить долгожданный снег из год в год он я бросать 
А еще я просрала Кравченко все метры и теперь она хуй в инстаграмм зайдет:)),1,а ещё я просрало кравченко весь метр и теперь она хуй в инстаграмм зайти 
"лежу в кровати,закуталась))еще бы вкусняшек кто -нибудь принес",1,лежать в кровать закутаться ещё бы вкусняшка кто нибыть принести 
@MrAkiko давай) Воронеж тебя ждет с распростертыми объятиями,1,давать воронеж ты ждать с распростереть объятие 
"Сижу смотрю с братиком  ""Гадкий Я""))) ВСЕМ ДОБРА))))",1,сидеть смотреть с братик гадкий я весь добро 
Едем по мосту со скоростью 20 км/ч под донт вори)))))) доставило)))),1,ехать по мост с скорость километр число под донт воря доставить 
"@DToropova АХАХАХХА ПРОСТИ, НО Я НЕМНОГО ЗАНЯТ :DD
В СЛЕДУЮЩИЙ РАЗ ОБЯЗАТЕЛЬНО ПОКАЖЕШЬ, ВСЕЕЕЕХ :DDDDD",1,ахахахха простить но я немного занятый в следующий раз обязательно показать всеееех 
"Перемен ждала. И дождалась)
Теперь буду ждать лето ",1,перемена ждать и дождаться теперь быть ждать лето 
"день выдался удачным, я ожидала худшего, но у меня даже настроение отличное и это несмотря на то, что я ночью меньше 5 часов проспала:)",1,день выдаться удачный я ожидать плохой но у я даже настроение отличный и это несмотря на то что я ночью маленький часы проспать 
"@NicoleKlof дааа)) так что приезжай загорать и сразу на чай, этажом выше",1,дааа так что приезжать загорать и сразу на чаять этаж выше 
"Q: Очень нравятся Ваши песни, Андрей! Успехов Вам)))  A: http://t.co/BDM6BXSoaN",1,очень нравиться ваш песнь андрей успех вы 
"-Айгуль Маратовна, сколько за ппт?
-9.
-из 20?
-из 10.
-спасибо за щедрость!
-ну тебе же надо заканчивать уже.

вот это человечность:)",1,айгуль марат сколько за ппт из из спасибо за щедрость ну ты же надо заканчивать уже вот это человечность 
Радостных выходных!)))http://t.co/MDBsfzF5ml с помощью @youtube,1,радостный выходной с помощь 
Классная позвала в клуб) мммммммм)) очень интересно) ахахаххаха,1,классный позвать в клуб мммммммм очень интересно ахахаххах 
"ой, Angel Beats начинается 11 апреля! весна становится всё интереснее :)",1,ой начинаться апрель весна становиться весь интересный 
@De_nativo Опять что ли подозреваешь? ;))))) Ну как для чего? Что бы знать насколько в разных городах живём! ;),1,опять что ли подозревать ну как для что что бы знать насколько в разный город жить 
@mego_cheshire @Korotchikoff  что уже всё обломались с твитером?) скучно тут стало или что?,1,что уже весь обломаться с твитер скучно тут стать или что 
@Amiko_chan  Оно)ты не смотрела?)ты любишь клоунов?),1,оно ты не смотреть ты любить клоун 
"Ostap CAE Group . Наш девиз - ""И тут Остапа понесло"". Никогда не заканчиваем спикинг вовремя)",1,наш девиз и тут остап понести никогда не заканчивать спикинг вовремя 
Дежурить с хомой  и саней ахуенно )ибо нихуя не делаешь+весело )люблю их ^^,1,дежурить с хома и сани ахуенно ибо нихуй не делать весело любить они 
"Говорят, что сейчас на такие портфели мода в городе. Правда? =) http://t.co/MALGjKoKvv",1,говорят что сейчас на такой портфель мода в город правда 
"8-ые пришли)) я опять запредельно радуюсь,  часы черного цвета это двойная радость^^ #мояпрелесть… http://t.co/oBXeKaU1G1",1,ые прислать я опять запредельно радоваться часы чёрный цвет это двойной радость мояпрелесть 
@chivonapets это он любит) прикольно было бы наверное по МКАДу на лыжах 80 км/ч шпарить),1,это он любить прикольный быть бы наверное по мкаду на лыжа километр число шпарить 
@arinalen  ахах тут еще у одной девочки фамилия Тимофеева была:D:3,1,ахи тут ещё у один девочка фамилия тимофеев быть 
пальцы совсем отвыкли от гитары. а та даже практически не расстроена),1,палец совсем отвыкнуть от гитара а тот даже практически не расстроить 
"В 5 классе будет учиться, на радость англичанке нашей))",1,в класс быть учиться на радость англичанка наш 
