text,positive,lemm_text
"О Боже, влюбленная душа опять объявилась и начала свою песню.. Только обрадовалась, что наконец пропал.. Уууффф(( просто why, God, whyyy??",0,о бог влюбить душить опять объявиться и начало свой песня только обрадоваться что наконец пропасть уууффф просто 
@Lesya_Galieva Зачем ты напомнила? Я только отвлеклась(((((,0,зачем ты напомнить я только отвлечься 
"RT @hei_niga: @podgruzilo2 ааа,мою любимую?((",0,ааа мой любимый 
"И самое хреновое то,что я еще и дз не узнал на завтра(",0,и самый хреновый то что я ещё и дз не узнать на завтра 
"Я такие макарошки сотворила, со всякими классными специями и овощами, а они взяли и отказались:(",0,я такой макарошка сотворить с всякий классный специя и овощ а они взять и отказаться 
Давай уезжай...(((((((((((((Бросай меня...и Уходи http://t.co/XO491zRWUl,0,давать уезжать бросать я и уходить 
"опрокинула тортик кремом вниз :( 
угадайте, откуда у меня растут руки?",0,опрокинуть тортик крем вниз угадать откуда у я расти рука 
"@F_Nastasia тоже последний,но 25,в субботу,это вообще боль;(",0,тоже последний но в суббота это вообще боль 
"@khmelina пока что у меня школьная программа 10-11 кл. норм пока что, но с физикой у меня плохо(",0,пока что у я школьный программа кл норма пока что но с физика у я плохо 
"Пиздец дела,такой крюк делать теперь придется :-(",0,пиздец дело такой крюк делать теперь прийтись 
Не хочу.. Опять выходные прошли(( http://t.co/wZdwKcymKT,0,не хотеть опять выходной пройти 
блять.болят все кости рук.ломит.что за пиздец?(,0,блять болеть весь костя рука ломить что за пиздец 
"То чувство когда твой портрет хуже, портрета одиннадцатилетнего ребёнка...

=""""(",0,то чувство когда твой портрет худой портрет одиннадцатилетний ребёнок 
"@holiavina @_Vikesha_ ;(
пойти поплакать что-ли..",0,пойти поплакать что ли 
"RT @mishinalera: @Homiak_09 я знаааю, но я тоже хочу стильное модное обновление(99(99(((((",0,я знааать но я тоже хотеть стильный модный обновление 
"Блин хочу что б этот день закончился(
Он мне надоел
Ненавижу такие дни",0,блин хотеть что б этот день закончиться он я надоесть ненавидеть такой день 
"@Lentaika80lvl по привычке смайлик :|
Я эту пизду хочу изумлять в говне.",0,по привычка смайлик я этот пизда хотеть изумлять в говно 
Не хочу понедельник! :( Не хочу в школу! :(,0,не хотеть понедельник не хотеть в школа 
@tournickiet БЕЗ ТЕБЯ ШАПОЧКУ НЕ МОГУ СЕБЕ ВЫБРАТЬ (((,0,без ты шапочка не мочь себя выбрать 
Пойдём гулять с бро вдвоём. Никто с нами гулять не хочет. У всех есть дела поважнее нас(,0,пойти гулять с бро вдвоём никто с мы гулять не хотеть у весь есть дело важный мы 
Пищала в своем своем парне и в своем мире:(,0,пищать в свой свой парень и в свой мир 
Я разосралась со своей единственной подругой =(,0,я разосраться с свой единственный подруга 
"@wapovaloveslesb мне лень, я слишком ленивый. Моя лень даже сильнее страха перед вк (",0,я лень я слишком ленивый мой лень даже сильный страх перед вк 
"@avdienko2014 окей не будет , это не сказка , а жизнь :-( *",0,окей не быть это не сказка а жизнь 
"То чувство,когда у тебя совсем нет друзей сериаломанов и тебе не с кем обсудить сериал(",0,то чувство когда у ты совсем нет друг сериаломан и ты не с кто обсудить сериал 
@dzurilla24 Сегодня с утра народ забегал за чистящим-моющим-отмывающим...Отношение к традициям оч изменилось(((,0,сегодня с утро народ забегать за чистить моющий отмывать отношение к традиция оч измениться 
"@SPB_citizen @Shlegel Вот и вся их ""мораль""(",0,вот и весь они мораль 
@__gale ой ну все пизда как я без твоего пароля проживу((((((((,0,ой ну весь пизда как я без твой пароль прожить 
"твиитееер, почему я так долго в тебе не пишу?(",0,твиитееер почему я так долго в ты не писать 
"RT @Lihotina: Температура меньше стало
Но все равно плохо(",0,температура маленький стать но весь равно плохо 
"Как ни крути,я все равно тебя ревную((...",0,как ни крутить я весь равно ты ревновать 
А то что-нибудь сломаете. :~( #ff #follow,0,а то что нибыть сломать 
"Надо ещё алгебру сделать, а мне так плохо и леньки((",0,надо ещё алгебра сделать а я так плохо и ленька 
"RT @twitruchp: Почему кто то красивый?
А кто то я!(",0,почему кто то красивый а кто то я 
"Автоинформатор @sberbank предлагает сказать пароль на кассе МТС при оплате услуг за бонусные баллы ""Браво"". Действительно ""Браво""-КРУТО((((",0,автоинформатор предлагать сказать пароль на касса мтс при оплата услуга за бонусный балл бравый действительно бравый круто 
"Ооооо, как же я заебалась работать!хочу зарплату и укушаться элитнным бухлом с коктейльчиками(((",0,ооооо как же я заебалася работать хотеть зарплата и укушаться элитнный бухлый с коктейльчик 
RT @mari_laryushina: Дурацкая биология:((такой бред(((как его запомнить?!((дайте мне отдохнуть!!!,0,дурацкий биология такой бред как он запомнить дать я отдохнуть 
@udalovmaxim привет... ну вот((( а я ждала от вас восторженного твита и фотки со счастливой улыбкой возле проруби :-(,0,привет ну вот а я ждать от вы восторженный твит и фотка с счастливый улыбка возле прорубь 
"В голове туман, такое ощущения что я всё ночь плакала, ах да я же всё таки всё ночь плакала(((",0,в голов туман такой ощущение что я весь ночь плакать ах да я же весь таки весь ночь плакать 
@INeedTheFans @markc_winchest а я вообще о Фроше первый раз слвшу о_О хдд,0,а я вообще о фрош один раз слвша о о хдд 
"Мало того, что всю ночь не спала, так еще на улице ужасно холодно, в такой холод не очень хочется куда то идти:(",0,мало тот что весь ночь не спасть так ещё на улица ужасно холодный в такой холод не очень хотеться куда то идти 
"Так лень что либо делать(((
А нужно писать..",0,так лень что либо делать а нужно писать 
сходила в альфу( всё самое интересное пропустила(((,0,сходить в альф весь самый интересный пропустить 
"@SerIkerRM ой,не хочу нагружать,забей,сейчас я успокоюсь(",0,ой не хотеть нагружать забить сейчас я успокоиться 
"Я хочу куда-нибудь свалить, на время. Я так давно не собирала куда-нибудь вещи. Хочу собраться и съебаться(",0,я хотеть куда нибыть свалить на время я так давно не собирать куда нибыть вещий хотеть собраться и съебаться 
"Только пришла домой((опять гуляла ,устала уже",0,только пришлый домой опять гулять устать уже 
"RT @incredible_nat: Не, товарищи, мне всего 15 лет и зрение у меня как у говна просто! За что мне такое наказание?! :(",0,не товарищ я всего год и зрение у я как у говно просто за что я такой наказание 
"не хочет Никита писать хню в ленте из-за меня,и просит угомониться. ну бля,я только разошелся :(",0,не хотеть никита писать хню в лента из за я и просить угомониться ну бля я только разойтись 
"RT @BigRussianBaws: Не понимаю людей, которые обтягивают золотой пленкой мазерати вместо кузова из настоящего золота(",0,не понимать человек который обтягивать золотой плёнка мазерать вместо кузов из настоящий золото 
"RT @anton_jak_46112: Раньше человека называли ""трудоголик"", а теперь ""задрот"" :(",0,ранний человек называть трудоголик а теперь задрот 
"если б я знала что ты ему не скажешь, а он ему! то я бы тебе всё доверила((",0,если б я знать что ты он не сказать а он он то я бы ты весь доверить 
"пишу немец ,всё не как не напишу это сочинение(",0,писать немец весь не как не написать это сочинение 
"@PolinaMeleshko1 нужно было с ним познакомиться 
такую возможность упустили (
не каждый день настоящего рыцаря встретишь",0,нужно быть с он познакомиться такой возможность упустить не каждый день настоящий рыцарь встретить 
"Я два дня смеюсь как Сельма и Петти:( о, мое горло",0,я два день смеяться как сельма и петти о мой горло 
Как же меня это огорчает:(Люди не знают какой СЕГОДНЯ ДЕНЬ,0,как же я это огорчать человек не знать какой сегодня день 
"Холодно, холодно, холодно
Даже в аудиториях холодно
Моя любимая батарея не греет меня((((",0,холодный холодный холодный даже в аудитория холодный мой любимый батарея не греть я 
"..ну вот хоть и снег пошёл, но блеать...нихуя не радует!!!!!1((((",0,ну вот хоть и снег пойти но блеать нихуй не радовать 
"О Господи, какая же тупая эта комедия «Горе от ума», ну вот почему нам не задают читать нормальную литературу? Постоянно хуйню читаем:(",0,о господь какой же тупой этот комедия горе от ум ну вот почему мы не задавать читать нормальный литература постоянно хуйня читаемый 
@barbpalvinldf но ты была сонласна:( ты где?,0,но ты быть сонласна ты где 
"@house_of_lazine ахахах
и я про тоже,а учителя не верят:(",0,ахахи и я про тоже а учитель не верить 
"RT @potemkina01: Жизньболь когда понимаешь,что тебе еще делать 8-10 уроков на понедельник и на вторник:((( ааа",0,жизньболь когда понимать что ты ещё делать урок на понедельник и на вторник ааа 
@IraKrainova дааа видела очень трогательно: (((,0,дааа видеть очень трогательно 
"Такая погодка хорошая на улице, а погулять не с кем :(",0,такой погодка хороший на улица а погулять не с кто 
"Боже, я не думала, что снова с такой силой захочу... замуж... :( только нет конкретного человека. это самое ужасное",0,бог я не думать что снова с такой силой захотеть замуж только нет конкретный человек это самый ужасный 
RT @firkova: Люди из МИСиСа боятся так матана ( мне бы так(( но я боюсь совсем другого,0,человек из мисиса бояться так матана я бы так но я бояться совсем другой 
Блин почему нагло удаляет мои статусы:((ничего не пойму роде без матов а удаляют((((((((((,0,блин почему нагло удалять мой статус ничто не понять род без матовый а удалять 
"Блин,я понимаю что я с тобой 2 недели не гуляла,но я так не хочу идти на улицу!((",0,блин я понимать что я с ты неделя не гулять но я так не хотеть идти на улица 
"Как же он похож на тебя (((( я тебя люблю, до сих пор, несмотря ни на что(((",0,как же он похожий на ты я ты любить до сей пора несмотря ни на что 
"@niallesistible жесть, я так и не поняла, что такого плохого он написал Лиаму:(",0,жесть я так и не понять что такой плохой он написать лиаму 
"Вроде бы и солнышко, но сука хоооолодно :(",0,вроде бы и солнышко но сук хоооолодный 
"блин вот так всегда,откладываешь, откладываешь, а в итоге делаешь потом все с разу:(",0,блин вот так всегда откладывать откладывать а в итог делать потом весь с раз 
"@MsWildFan дааа :
Некуда не деться даже (",0,дааа некуда не деться даже 
"Я очень долго привыкала, когда Малик поменял имя, а тут... ((((9(",0,я очень долго привыкать когда малик поменять имя а тут 
"@abunin  то есть лингвистически правильно:
&lt;а на шее у него толстая ментовская цепУра?&gt;

а, или может цепурА?.. вот хз,чо за убогое слово ((",0,то есть лингвистически правильно а на шея у он толстой ментовский цепур а или мочь цепур вот хз чо за убогий слово 
"RT @Normalno_O: Петрова вечно мне пишет в тетради «мяу», все тетради  мне исписала с:",0,петров вечно я писать в тетрадь мяу весь тетрадь я исписать с 
"Испанский он такой, что я схожу с ума. Даже без знаний испанского вы все поймете: первая строчка ( http://t.co/5DKFzmJl7I",0,испанский он такой что я сходить с ум даже без знание испанский вы весь понять один строчка 
"@ligatura_t искала там, не было( про студии не думала, спасибо!",0,искать там не быть про студия не думать спасибо 
"RT @Z__Talibova: @_Daria_V_ аха:-D выходные,1 день разве выходной?:-(",0,аха выходной день разве выходной 
"То чувство, когда мама кошку любит больше чем меня(",0,то чувство когда мама кошка любить большой чем я 
Выходные. Пати. А тест в пн никто не отменял..(,0,выходной пать а тест в пн никто не отменять 
"Всёё, реву как сучка! ;((((((((((((((((((((((((((( http://t.co/7GEMtPjeEJ",0,всёё реветь как сучка 
"@all_the_drugs :з
у него жена есть вроде ;(",0,з у он жена есть вроде 
"@Zlata62442 если б отдыхать,почти весь день на домашку уходит(",0,если б отдыхать почти весь день на домашка уходить 
За сегодняшний день порезала один и тот же палец два раза( терпеть не могу наточенные кухонные ножи(,0,за сегодняшний день порезать один и тот же палец два раз терпеть не мочь наточить кухонный нож 
"цирк уехал, клоуны остались( давайте, помогите мне",0,цирк уехать клоун остаться давать помочь я 
"Отказ от курения – это серьезный стресс для организма курильщика.
((((((((((((((((((((((((((9",0,отказ от курение это серьёзный стресс для организм курильщик 
"RT @Anastasiy_May: Завтра в школу. А чувство такое, будто в ад:(",0,завтра в школа а чувство такой будто в ада 
"меня трудно обидеть,но,по-моему,ты стараешься((",0,я трудно обидеть но по мой ты стараться 
Мой кролик со вчерашнего дня ничего не ест и не пьёт :(,0,мой кролик с вчерашний день ничто не есть и не пить 
"RT @Ryakhovskaya: Парни ушли играть к Мише
Бросили нас
Сидим с Машей, красим ногти
:(",0,парень уйти играть к миша бросить мы сидеть с маша красить ноготь 
"Мне сказали, что у меня маленькие губы(((((((((((",0,я сказать что у я маленькая губа 
"@the_kovboy да я похоже опять того, нах кранкенхаус стремлюсь(((",0,да я похоже опять тот нах кранкенхаус стремиться 
Никто не хочет кататься на коньках(( сама решила что лучше кататься на ватрушке и Дима сверху,0,никто не хотеть кататься на конёк сам решить что хороший кататься на ватрушка и дима сверху 
"Милые мои окружающие меня "" люди "" я знаю что вы меня "" любите"" ! С праздником!!   ( если вас окружают крысы - значит ваш корабль на плову !",0,милый мой окружающий я человек я знать что вы я любить с праздник если вы окружать крыса значит ваш корабль на плов 
Голова болеть не перестает Температура не спадает :(((((((((( http://t.co/yTEdqVxhYZ,0,голова болеть не переставать температура не спадать 
"настроение на нуле и сидеть в интернете совершенно не хочется, так же как и есть и делать уроки 
я как овощ :(",0,настроение на нуль и сидеть в интернет совершенно не хотеться так же как и есть и делать урок я как овощ 
RT @LastKilljoy: Вот что я за человек? :((,0,вот что я за человек 
"@GrigorievOleg @SUUPER_S блин, ребят, мне вставать рано завтра и я устала((",0,блин ребята я вставать рано завтра и я устать 
"RT @aquteru: В наше время жена бесполезный груз :( Дома ничего не делает, не работает, и даже за ребёнком уследить не может",0,в наш время жена бесполезный груз дом ничто не делать не работать и даже за ребёнок уследить не мочь 
"Рубашка=( напомнило сильно, признаюсь ,что скучаю",0,рубашка напомнить сильно признаться что скучать 
Не ну нормально вообще?у меня мама мороженку забрала:(((,0,не ну нормальный вообще у я мама морожёнка забрать 
"Моя мамочка уже третий день в больнице:(
Я очень скучаю по ней и люблю ее",0,мой мамочка уже три день в больница я очень скучать по она и любить она 
"@GaGa_oo_lala вот какашка,у меня то же самое было с фоном(
но на следующий день получилось с:::",0,вот какашка у я то же самый быть с фон но на следующий день получиться с 
"Сердце кровью обливается,как представлю,какая атмосфера сейчас в Дании,а я здесь,с инетом -тормозом и экзаменами :( #EHFEuro #Denmark",0,сердце кровь обливаться как представить какой атмосфера сейчас в дания а я здесь с инетом тормоз и экзамен 
"Ребят, не знаю как вы, но мне так лень готовится к культуре!( я уже все по дому сделала, книгу прочитала, но так и не начала готовится(",0,ребята не знать как вы но я так лень готовиться к культура я уже весь по дом сделать книга прочитать но так и не начало готовиться 
"@stupid_meds вот если бы хороший интернет, то я бы посмотрела(",0,вот если бы хороший интернет то я бы посмотреть 
